slug,city,state_code,state_name,metro_label,news_angle,transparency_note,logistics_note,description_seed,related_1,related_2,related_3,index
denver-co,Denver,CO,Colorado,Front Range,"Front Range university coverage, Mountain West laboratory reporting, and regional policy updates often shape the Denver news cycle.","Readers in Denver usually care about readable COAs, lot-specific documents, and whether laboratory documentation feels current rather than generic.","Mountain-region shipping timelines, weather-related handling notes, and clear carrier language tend to matter more in Denver than vague nationwide promises.","A Denver-focused look at peptide research news, documentation standards, and supplier transparency signals for Colorado readers.",phoenix-az,dallas-tx,chicago-il,true
phoenix-az,Phoenix,AZ,Arizona,Southwest,"Phoenix coverage often centers on Southwest research trends, catalog changes, and how sites explain heat-sensitive handling and storage context.","Supplier pages that spell out batch testing and research-use labeling clearly stand out more in Phoenix than pages that rely on broad marketing language.","Desert-climate shipping notes, cutoff times, and fulfillment transparency tend to be especially relevant for readers in Arizona.","A Phoenix peptide research news guide covering Arizona-specific transparency cues, documentation habits, and shipping language.",los-angeles-ca,san-diego-ca,denver-co,true
miami-fl,Miami,FL,Florida,South Florida,"Miami news angles often involve port access, international shipping language, and broader Southeast research and logistics coverage.","For Miami readers, third-party testing claims matter more when they are paired with easy-to-open COAs and consistent labeling language.","International routing language, customs-facing wording, and clear dispatch notes are especially important in a city with strong global shipping ties.","A Miami transparency guide focused on South Florida peptide news, documentation habits, and international shipping language.",tampa-fl,new-york-ny,dallas-tx,true
austin-tx,Austin,TX,Texas,Central Texas,"Austin coverage often overlaps with Texas biotech headlines, startup-style supplier presentation, and domestic fulfillment messaging.","Austin readers usually benefit from pages that explain documentation, catalog categories, and batch-testing notes without forcing extra clicks.","Central-Texas shipping clarity, warehouse location hints, and plain-language fulfillment updates tend to be more useful than vague speed claims.","An Austin peptide news page centered on Texas research coverage, supplier clarity, and documentation signals.",dallas-tx,phoenix-az,denver-co,true
los-angeles-ca,Los Angeles,CA,California,Southern California,"Los Angeles coverage often intersects with port logistics, Southern California research headlines, and large-catalog supplier competition.","In Los Angeles, supplier transparency often comes down to how well a site pairs third-party testing claims with real laboratory documentation.","Port and airport freight language, dispatch expectations, and West Coast carrier clarity tend to matter more than oversized promotional copy.","A Los Angeles supplier transparency guide focused on Southern California news signals and documentation quality.",san-diego-ca,phoenix-az,austin-tx,true
san-diego-ca,San Diego,CA,California,San Diego biotech corridor,"San Diego readers often track biotech-corridor headlines, university-linked reporting, and how research catalog trends move through Southern California.","Pages that keep research-use labeling consistent across product, FAQ, and policy content usually read better than pages that bury that language.","Cross-border logistics context, coastal shipping windows, and careful documentation language can be especially relevant in San Diego.","A San Diego peptide research news page covering biotech-corridor trends, documentation cues, and shipping clarity.",los-angeles-ca,phoenix-az,denver-co,true
new-york-ny,New York,NY,New York,New York metro,"New York coverage often mixes media reporting, East Coast distribution headlines, and regulatory or policy discussion that shapes how suppliers present themselves.","For New York readers, a supplier page usually feels stronger when laboratory documents, contact details, and policy notes are all easy to locate.","Dense East Coast shipping networks, cutoff-time clarity, and warehouse transparency often matter more than broad national language.","A New York peptide research news guide focused on East Coast transparency, documentation, and distribution language.",chicago-il,miami-fl,tampa-fl,true
chicago-il,Chicago,IL,Illinois,Midwest,"Chicago reporting often leans toward Midwest freight patterns, warehouse routing, and how large supplier catalogs explain documentation quality.","Chicago readers usually benefit from supplier pages that make batch testing, PDF access, and research-use labeling easy to compare side by side.","Midwest fulfillment language, carrier consistency, and cross-country shipping estimates tend to matter more in Chicago than generic speed claims.","A Chicago transparency guide covering Midwest peptide news, freight-related context, and laboratory documentation cues.",dallas-tx,new-york-ny,denver-co,true
dallas-tx,Dallas,TX,Texas,North Texas,"Dallas coverage often emphasizes central-U.S. shipping lanes, Texas supplier competition, and how catalogs explain research documentation.","In Dallas, clearer third-party testing notes and cleaner COA access usually make a bigger impression than broad purity slogans.","Central distribution language, warehouse visibility, and dispatch timing tend to be especially relevant for North Texas readers.","A Dallas peptide research news guide focused on central-shipping transparency and documentation standards.",austin-tx,chicago-il,miami-fl,true
tampa-fl,Tampa,FL,Florida,Tampa Bay,"Tampa coverage often overlaps with Florida port access, Southeast catalog trends, and how sites talk about domestic versus international routing.","Tampa readers usually get more value from pages that show current laboratory documentation and plain shipping details than pages that lean on hype.","Gulf Coast fulfillment notes, storm-season shipping clarity, and straightforward carrier language can matter more in Tampa than generic national copy.","A Tampa peptide research news guide focused on Southeast shipping clarity, supplier transparency, and laboratory documentation.",miami-fl,new-york-ny,dallas-tx,true
